2;Cities Race to Resilience Coalition;CitiesR2R;1,18E+11;446275184;07/18/2022 12:03:51 PM;10-04-2022 14:42;1972452623;;;;;Cities Race to Zero (Resilience) Coalition;4- This subcategory is in the core of the most of our actions;Equity is at the heart of the 64 different commitments cities can make across the 11 thematic areas of BUILDINGS, DIGITALIZATION, ENERGY, FOOD SYSTEMS, GOVERNANCE AND COMMUNITY ENGAGEMENT, NATURE-BASED SOLUTIONS, RISK AND VULNERABILITY PLANNING, SOCIAL EQUITY, URBAN-RURAL LINKAGES, WASTE, and WATER.     In particular, the following commitments can be made by cities under the thematic area of Social Equity:  Ensure social justice is taken into account when developing climate & resilience strategies, actions and policies in the city, including considerations of social equity in public services delivery, affordability and access  Empower leaders amongst marginalised groups and communities to take a lead in disaster scenarios in order to effectively voice the needs of these groups, and to have access to the right platforms in order to do so  Create strategies to ensure children, the elderly and people with disabilities are accounted for in disaster scenarios, so as to not be disproportionately affected  Promote gender and/or racial sensitivity training for all civil servants engaged in the development and implementation of resilience strategies, including city officials, civil defense, health care workers, teachers and police officers, promoting values of care, empathy and respect  Raise awareness about the vulnerability of poor communities and the need for solidarity actions between communities and districts  Create counselling and emotional wellness programs as well as job-finding and entrepreneurship centres to support local communities as well as climate refugees/migrants to combat trauma and disempowerment. Improving social resilience and social cohesion increases peoples’ ability to endure and manage in times of crisis  Provide more funding and capacity for gender-based violence hotlines and counselling services, particularly during the response and recovery phases which further expose already vulnerable populations as seen during the lockdowns in response to the COVID-19 pandemic;;3- This subcategory is in the core of an important part of our actions;Women and girls;LGTBQIA+ people;Elderly;Children & Youth;Indigenous and traditional communities;Racial, ethnic or religious minorities;Refugees;Disabled People;Low income communities;;VMC are partners/co-leads in the project/action;VMC are consulted (unidirectional) prior to the project/action;VMC are consulted (unidirectional) during the project/action;VMC co-construct the content of the project/action;;;;Involvement and impact are intentional;;By joining the Cities Race to Resilience, cities pledge to undertake a risk and vulnerability assessment. Cities can furthermore make a specific commitment to integrate local, gender-sensitive and indigenous knowledge and community-based mapping initiatives in all climate risk analysis to ensure validation and prioritization is informed by impacted communities especially the most vulnerable.   Through the thematic area of Governance and community engagement, cities are able to commit to including social equity quotas in governance processes, to ensure that people of all genders, races, ethnicities, abilities and classes are represented equitably in community and political life, and that their needs can be assured. In addition, cities can commit to establishing & improving mechanisms for community based organisations and community members to contribute to city-scale resilience plans and actions from the beginning to the end of processes.   ALL commitments that can be made under the thematic area of Social Equity take into account VMCs.;;3- This subcategory is in the core of an important part of our actions;Under the thematic area of Buildings, cities can commit to the following:  - Develop a resilience strategy for buildings to ensure they can withstand the impacts of climate hazards ex. preparing buildings for large storm impacts  - Create a publicly accessible inventory of public assets and infrastructure, including hospitals, schools, and university buildings, their condition, exposure to hazards, and maintenance history  - Initiate consultation processes with communities living in informal settlements in hazardous areas, such as flood plains, in order to begin urban upgrading or co-planned resettlement processes    Under the thematic area of Energy, cities can commit to investing in and planning for resilience of the energy grid and renewable energy assets to ensure continuity of services to the community, including the most vulnerable, all critical urban infrastructure and public assets    Commitments to the thematic area of Nature-based solutions include preparedness via planning for the sustainable management, protection and restoration of coastal areas and ecosystems such as mangroves, seagrasses, flats, tidal marshes. In addition, cities can commit to dedicate 30-40% of the total built-up city surface to green and permeable spaces which favor protecting and restoring biodiverse and climate resilient ecosystems which support resilient outcomes. Another commitment related to preparedness is to increase investment in nature-based solutions and smart low carbon technologies to address water risks i.e. pollution, flooding, drought, leakage etc.;;3- This subcategory is in the core of an important part of our actions;"Cities can commit to Risk and vulnerability planning, and undertake to:  
- Integrate local, gender-sensitive and indigenous knowledge and community-based mapping initiatives in all climate risk analysis to ensure validation and prioritization is informed by impacted communities especially the most vulnerable.
- Install early hazard warning systems and emergency management systems (including the identification of the percentage of the population that has access to the systems). 
- Identify, monitor, and plan accordingly to anticipate acute shocks and to adapt for addressing chronic stresses.    
In addition, via Governance and community engagement commitments, cities can integrate aspects of resilience across urban planning via commitments to:  
- Develop financing and governance mechanisms to improve basin level water resilience.  
- Devolve governance and fiscal responsibility to allow for local entities to drive impactful water resilience interventions.  
- Designate a city official/advisor to coordinate and undertake resilience projects and to engage with urban stakeholders, for example a Chief Resilience Officer.";;1- We contribute to this subcategory but indirectly, It’s not in the core of our activities;"Commitments under Governance processes include the options for experential learning, via:  
- Including social equity quotas in governance processes, to ensure that people of all genders, races, ethnicities, abilities and classes are represented equitably in community and political life, and that their needs can be assured.
- Establishing & improving mechanisms for community based organisations and community members to contribute to city-scale resilience plans and actions from the beginning to the end of processes.";;2- A few of our actions contribute to this subcategory;Via the thematic area of Social Equity, cities can commit to:  - Promote gender and/or racial sensitivity training for all civil servants engaged in the development and implementation of resilience strategies, including city officials, civil defense, health care workers, teachers and police officers, promoting values of care, empathy and respect  - Raise awareness about the vulnerability of poor communities and the need for solidarity actions between communities and districts. Cities furthermore have the option to commit to adopt education programs or trainings to mainstream the concept of the right to nature and behavioural shift to consider nature as a common good that is respected.;;2- A few of our actions contribute to this subcategory;Cities can commit to empower leaders amongst marginalised groups and communities to take a lead in disaster scenarios in order to effectively voice the needs of these groups, and to have access to the right platforms in order to do so. Governance and community engagement commitments. (covered already) also ensure autonomy of targeted groups, such as VMCs.;;1- We contribute to this subcategory but indirectly, It’s not in the core of our activities;Via Governance and community engagement thematic area, cities can choose to commit to the following }options that enhance leadership for increased resilience:  Establish new and inclusive approaches to governance that embrace a balance between economic and well-being values, co-designing the vision and the choices for a comprehensive strategy that integrates climate, social and health objectives  Include social equity quotas in governance processes, to ensure that people of all genders, races, ethnicities, abilities and classes are represented equitably in community and political life, and that their needs can be assured  Establish & improve mechanisms for community based organisations and community members to contribute to city-scale resilience plans and actions from the beginning to the end of processes.    Cities can also commit to Empowering leaders amongst marginalised groups and communities to take a lead in disaster scenarios in order to effectively voice the needs of these groups, and to have access to the right platforms in order to do so, via this commitment under Social Equity.;;2- A few of our actions contribute to this subcategory;See previous response.;;2- A few of our actions contribute to this subcategory;Through a number of Governance and Community engagement and Social Equity commitments, as well as commitments across other thematic areas, cities can act to increase resilience via prioritising collective participation of their constituents, such as:    - (SOCIAL EQUITY) Establish & improve mechanisms for community based organisations and community members to contribute to city-scale resilience plans and actions from the beginning to the end of processes  - (NATURE BASED SOLUTIONS) Adopt education programs or trainings to mainstream the concept of the right to nature and behavioural shift to consider nature as a common good that is respected  - (WATER) Aim to achieve collective water security and alignment with national or basin-level water goals by working together with other cities, companies, community associations and water users operating in your watershed to mitigate water-related conflicts linked to water use and pollution.;;3- This subcategory is in the core of an important part of our actions.;Under Digitalisation commitments, cities have the opportunity to take the following actions that improve and enhance connectivity:  - Advance digital inclusion to ensure the vulnerable population has proper access to digital infrastructure, connectivity, and knowledge to participate in the digital world  - Strengthen digital commerce with a particular focus on onboarding small and medium businesses and entrepreneurs to build a strong and inclusive local economy  - Promote digital public services, open government practices, and secure data management policies to increase transparency and citizen participation.;;2- A few of our actions contribute to this subcategory;Under different thematic areas, cities have the opportunity to commit to actions that enhance networking, such as the following:    - (FOOD SYSTEMS) Create a food council/board with local stakeholders by 2025, and  - (FOOD SYSTEMS) Create enabling environments for local and regional small-scale and agroecological producers and traders (including informal traders) to access market share, through financial incentives and market access programmes  - (Governance and community engagement) Establish & improve mechanisms for community based organisations and community members to contribute to city-scale resilience plans and actions from the beginning to the end of processes, and   - (Governance and community engagement) Designate a city official/advisor to coordinate and undertake resilience projects and to engage with urban stakeholders, for example a Chief Resilience Officer  - (SOCIAL EQUITY) Raise awareness about the vulnerability of poor communities and the need for solidarity actions between communities and districts, and  - (SOCIAL EQUITY) Create counselling and emotional wellness programs as well as job-finding and entrepreneurship centres to support local communities as well as climate refugees/migrants to combat trauma and disempowerment. Improving social resilience and social cohesion increases peoples’ ability to endure and manage in times of crisis,  - (URBAN-RURAL LINKAGES) Cooperation programs between municipalities to financially compensate or share duties and benefits of natural resources and their management, for example waste disposal, water basin management, wastewater treatment, etc, and  - (URBAN-RURAL LINKAGES) Design urban policies and create enabling environments to ensure the immediate agricultural hinterlands have sustainable access to market share, for example in the form of local market spaces and building relationships with retail,  - (WATER) Aim to achieve collective water security and alignment with national or basin-level water goals by working together with other cities, companies, community associations and water users operating in your watershed to mitigate water-related conflicts linked to water use and pollution.;;2- A few of our actions contribute to this subcategory;"Under WATER commitments, cities have the opportunity to take the following actions that enhance diversity of their plans:  - Monitor and publish future water availability risks and scenarios related to population growth and other risk drivers,  - Scale comprehensive upgrading efforts for the water-insecure urban poor communities facing climate risk to ensure resilience of infrastructure investments  - Diversify water sources to account for future climate risks and increase investment in water resource conservation and water demand management  - Shift urban planning to account for hydrologically linked regions sustaining natural water flows and sources  - Develop an urban green infrastructure plan which maps key water retention zones and aquifers in order to preserve key water sources from urban development and pollution    Likewise, cities can commit to the following actions across other thematic areas, that improve diversity such as:  - (WASTE) Invest in circular economy assessments to repurpose and reduce waste and generate new business opportunities;  - (SOCIAL EQUITY) Ensure social justice is taken into account when developing climate & resilience strategies, actions and policies in the city, including considerations of social equity in public services delivery, affordability and access;  - (RISK AND VULNERABILITY PLANNING) Integrate local, gender-sensitive and indigenous knowledge and community-based mapping initiatives in all climate risk analysis to ensure validation and prioritization is informed by impacted communities especially the most vulnerable  - (RISK AND VULNERABILITY PLANNING) Install early hazard warning systems and emergency management systems (including the identification of the percentage of the population that has access to the systems)  - (RISK AND VULNERABILITY PLANNING)  Identify, monitor, and plan accordingly to anticipate acute shocks and to adapt for addressing chronic stresses.";;2- A few of our actions contribute to this subcategory;"There are a number of commitments cities can make that contribute towards increasing resilience via redundancy:    - (BUILDINGS) Update construction standards for infrastructure and building, accounting for local hazards and criticality, and enforcement mechanisms in place  - (BUILDINGS) Develop pre-approved contracts for emergency interventions (ex. debris removal) or reconstruction (ex. road repairs), with enhanced standards;  - (DIGITALIZATION) Amplify work from home opportunities and universalize the adequate conditions for workers to undertake labor using digital tools;  - (ENERGY) Invest in and plan for resilience of the energy grid and renewable energy assets to ensure continuity of services to the community, including the most vulnerable, all critical urban infrastructure and public assets  - (ENERGY) Invest in decentralized renewable energy sources to enhance access to clean sustainable energy, address energy security, and reduce energy poverty while improving climate resilience  - (NATURE-BASED SOLUTIONS) Dedicate 30-40% of the total built-up city surface to green and permeable spaces which favor protecting and restoring biodiverse and climate resilient ecosystems  - (NATURE-BASED SOLUTIONS) Convert 40-60% of the urban parking space to green and permeable spaces  - (URBAN-RURAL LINKAGES) Consider proximity and complementary between urban and rural areas in regional strategies, for example natural services, food supply, and cultural activities.";;1- We contribute to this subcategory but indirectly, It’s not in the core of our activities;Cities can commit to promoting financial resilience in indirect ways through a few actions, such as:    - (FOOD SYSTEMS) Create enabling environments for local and regional small-scale and agroecological producers and traders (including informal traders) to access market share, through financial incentives and market access programmes    Under GOVERNANCE AND COMMUNITY ENGAGEMENT commitments, cities can:   - Develop financing and governance mechanisms to improve basin level water resilience  - Devolve governance and fiscal responsibility to allow for local entities to drive impactful water resilience interventions.;;3- This subcategory is in the core of an important part of our actions;Cities can commit to a wide number of actions that build resilience of ecosystems and biodiversity, which include the following:    WATER:  - Diversify water sources to account for future climate risks and increase investment in water resource conservation and water demand management  - Shift urban planning to account for hydrologically linked regions sustaining natural water flows and sources  - Develop an urban green infrastructure plan which maps key water retention zones and aquifers in order to preserve key water sources from urban development and pollution    URBAN-RURAL LINKAGES:  - Keep the proportionality and land use ratio between rural/natural & urban areas in the administrative division, boundaries and plans to relate nature to all areas and all scale (incl neighborhood)  - Adopt education programs or trainings to mainstream the concept of the right to nature and behavioural shift to consider nature as a common good that is respected    NATURE-BASED SOLUTIONS:  - Commit a tree-planting or creation of green space target by 2025 that supports local biodiversity and is resilient to anticipated climate change  - Plan for the sustainable management, protection and restoration of coastal areas and ecosystems such as mangroves, seagrasses, flats, tidal marshes  - Dedicate 30-40% of the total built-up city surface to green and permeable spaces which favor protecting and restoring biodiverse and climate resilient ecosystems  - Convert 40-60% of the urban parking space to green and permeable spaces  - Ensure that 70% of the population has free access to a fit for purpose green and blue space within 15 minutes- equitably prioritized to maximize the accessibility and connectivity to nature for the most vulnerable  - Protect soil resources by limiting soil sealing and ensuring that soil characteristics are considered in decisions concerning allocation and use of land  - Invest in and plan for protecting, restoring, and sustainably managing inner, nearby, and faraway forests  - Increase investment in nature-based solutions and smart low carbon technologies to address water risks i.e. pollution, flooding, drought, leakage etc;;2- A few of our actions contribute to this subcategory;Via certain commitments, cities can take action towards building resilience through technology, specifically via:    DIGITALIZATION  - Advance digital inclusion to ensure the vulnerable population has proper access to digital infrastructure, connectivity, and knowledge to participate in the digital world,  - Promote digital public services, open government practices, and secure data management policies to increase transparency and citizen participation    ENERGY:  - Invest in and plan for resilience of the energy grid and renewable energy assets to ensure continuity of services to the community, including the most vulnerable, all critical urban infrastructure and public assets  - Invest in decentralized renewable energy sources to enhance access to clean sustainable energy, address energy security, and reduce energy poverty while improving climate resilience  - Provide 100% of my community with access to affordable, reliable, sustainable, and modern renewable and clean energy    RISK AND VULNERABILITY PLANNING  - Install early hazard warning systems and emergency management systems (including the identification of the percentage of the population that has access to the systems);;2- A few of our actions contribute to this subcategory;By committing to actions related to the thematic area of BUILDINGS, cities can improve the resilience of infrastructure:  - Develop a resilience strategy for buildings to ensure they can withstand the impacts of climate hazards ex. preparing buildings for large storm impacts  - Create a publicly accessible inventory of public assets and infrastructure, including hospitals, schools, and university buildings, their condition, exposure to hazards, and maintenance history  - Update construction standards for infrastructure and building, accounting for local hazards and criticality, and enforcement mechanisms in place  - Develop pre-approved contracts for emergency interventions (ex. debris removal) or reconstruction (ex. road repairs) approved, with enhanced standards  - Restrict development in areas that are at risk of climate impacts (ex. Areas at high risk of flooding, forest fires, etc.)  - Initiate consultation processes with communities living in informal settlements in hazardous areas, such as flood plains, in order to begin urban upgrading or co-planned resettlement processes.;;4- This subcategory is in the core of the most of our actions;As first responders to the climate crisis, cities have the opportunity to commit to a wide variety of actions that increase the resilience of emergency and social services both directly and indirectly, via the following:    FOOD SYSTEMS:  - Generate supportive policies for local traders and informal traders  - Create enabling environments for local and regional small-scale and agroecological producers and traders (including informal traders) to access market share, through financial incentives and market access programmes    GOVERNANCE AND COMMUNITY ENGAGEMENT:  - Establish & improve mechanisms for community based organisations and community members to contribute to city-scale resilience plans and actions from the beginning to the end of processes  - Develop financing and governance mechanisms to improve basin level water resilience  - Designate a city official/advisor to coordinate and undertake resilience projects and to engage with urban stakeholders, for example a Chief Resilience Officer    NATURE-BASED SOLUTIONS:  - Commit a tree-planting or creation of green space target by 2025 that supports local biodiversity and is resilient to anticipated climate change  - Plan for the sustainable management, protection and restoration of coastal areas and ecosystems such as mangroves, seagrasses, flats, tidal marshes  - Dedicate 30-40% of the total built-up city surface to green and permeable spaces which favor protecting and restoring biodiverse and climate resilient ecosystems  - Protect soil resources by limiting soil sealing and ensuring that soil characteristics are considered in decisions concerning allocation and use of land  - Invest in and plan for protecting, restoring, and sustainably managing inner, nearby, and faraway forests  - Increase investment in nature-based solutions and smart low carbon technologies to address water risks i.e. pollution, flooding, drought, leakage etc    RISK AND VULNERABILITY PLANNING:  - Integrate local, gender-sensitive and indigenous knowledge and community-based mapping initiatives in all climate risk analysis to ensure validation and prioritization is informed by impacted communities especially the most vulnerable  - Install early hazard warning systems and emergency management systems (including the identification of the percentage of the population that has access to the systems)  - Identify, monitor, and plan accordingly to anticipate acute shocks and to adapt for addressing chronic stresses    SOCIAL EQUITY  - Ensure social justice is taken into account when developing climate & resilience strategies, actions and policies in the city, including considerations of social equity in public services delivery, affordability and access  - Empower leaders amongst marginalised groups and communities to take a lead in disaster scenarios in order to effectively voice the needs of these groups, and to have access to the right platforms in order to do so  - Create strategies to ensure children, the elderly and people with disabilities are accounted for in disaster scenarios, so as to not be disproportionately affected    URBAN-RURAL LINKAGES  - Design urban policies and create enabling environments to ensure the immediate agricultural hinterlands have sustainable access to market share, for example in the form of local market spaces and building relationships with retail    WASTE:  - Collect all waste generated in the city and ensure residual waste is disposed of adequately in an engineered sanitary landfill, which considers and minimizes impact to surface and groundwater sources    WATER:  - Monitor and publish future water availability risks and scenarios related to population growth and other risk drivers  - Scale comprehensive upgrading efforts for the water-insecure urban poor communities facing climate risk to ensure resilience of infrastructure investments  - Diversify water sources to account for future climate risks and increase investment in water resource conservation and water demand management.;;Please note, we do not currently know which commitments for each city are a) already being undertaken, b) complete, or c) have not yet begun. We will not know until all our city's have completed their annual reporting progress.
