ID MASTER;PARTNER OFFICAL NAME;PARTNER SHORTNAME;Respondent ID;Collector ID;Start Date;End Date;IP Address;Email Address;First Name;Last Name;Custom Data 1;Name of initiative;To what extent do the actions developed by the initiative contribute to social equity through effective economic distribution and/or access to fundamental rights such as education, health, energy and water?;Describe how these actions contribute to increasing resilience in terms of equity (poverty reduction and access to fundamental rights).;If not, do you plan to carry out actions upon this subcaterory in the future?;To what extent do the actions developed by the initiative and its members contribute to the social integration of historically marginalized people and groups vulnerable to climate change?;Is your initiative working with historically marginalized communities? Select all that apply.;Column1;_1;_2;_3;_4;_5;_6;_7;_8;Level of engagement of involvement of vulnerable/marginalized communities (VMC)? Select all that apply.;_9;_10;_11;_12;_13;_14;Are the involment of and impact on VMCs intentional (i.e. the main focus of the project/action), or they are incidental (i.e. happenedby chance as a secundary impact)? Select one;_15;Describe how these actions contribute to increasing resilience in terms of inclusiveness (encouraging the inclusion of marginalized people).;If not, do you plan to carry out actions upon this attribute in the future?;To what extent do the actions developed by the initiative and its members contribute to building or strengthening the capacity to anticipate, prepare for, respond to and monitor socio-climatic hazards?;Describe how these actions contribute to anticipate, prepare for and respond to emergencies.;If not, do you plan to carry out actions upon this subcaterory in the future?_16;To what extent do the actions develop by the initiative and its members contribute to plan in the short, medium and long term in order to prevent and reduce climate risks and adaptation?;Describe how these actions contribute to making plans to reduce the risk of climate change;If not, do you plan to carry out actions upon this subcaterory in the future?_17;To what extent do the initiative and its members' actions contribute to developing reflective and experiential learning among individuals and groups, sharing knowledge, practices and past experiences?;Describe how these actions contribute to increasing resilience (encouraging the learning from past experiences and best practices).;If not, do you plan to carry out actions upon this subcaterory in the future?_18;To what extent do the actions developed by the initiative and its members contribute to providing new knowledge to targeted beneficiaries to know, understand and/or apply information focused on climate-related risks (social, economic and ecological)?;Describe how these actions contribute to increasing resilience (to provide new knowledge to participants and the ability to apply that knowledge).;If not, do you plan to carry out actions upon this subcaterory in the future?_19;To what extent do the actions developed by the initiative and its members contribute to developing ownership and free disposal of individual and collective resources by strengthening the autonomy of the targeted beneficiaries?;Describe how these actions contribute to increasing resilience (creating/strengthening autonomy in targeted actors) and who are the targeted beneficiaries.;If not, do you plan to carry out actions upon this subcaterory in the future?_20;To what extent do the actions developed by the initiative and its members contribute to creating and fostering different types of social leadership for coordination and collaboration roles?;Describe how these actions contribute to increasing resilience (to contribute to leadership building of targeted actors) and who are the targeted beneficiaries.;If not, do you plan to carry out actions upon this subcaterory in the future?_21;To what extent do the actions developed by the initiative and its members contribute to better individual and collective decision making, fostering social participation in the process and definition of decisions?;Describe how these actions contribute to increasing resilience (to create access of communities to decision-making) and who are the targeted beneficiaries.;If not, do you plan to carry out actions upon this subcaterory in the future?_22;To what extent do the actions developed by the initiative and its members foster social relations (intergenerational, between men and women, between different groups of interest), increasing the sense of belonging and community identity?;Describe how these actions contribute to increasing resilience (to foster collective participation, social capital, identity building and sense of belonging).;If not, do you plan to carry out actions upon this subcaterory in the future?_23;To what extent do the actions developed by the initiative and its members contribute to creating, improving or promoting communication processes between individuals and social groups?;Describe how these actions contribute to increasing resilience (to improve or encourage the communication process) and who are the targeted beneficiaries.;If not, do you plan to carry out actions upon this subcaterory in the future?_24;To what extent do the actions developed by the initiative and its members contribute to creating/promoting networks or associations of individuals or social groups that improve and/or catalyze social coordination and collaboration?;Describe how these actions contribute to increasing resilience (to create and/or promote the creation of networks/partnerships ) and who are the targeted beneficiaries.;If not, do you plan to carry out actions upon this subcaterory in the future?_25;To what extent do the actions developed by the initiative and its members contribute to (a) increasing and/or preserving the diversity of strategies available for the production of social and ecological services, products and processes and/or (b) incorpor;Describe how these actions contribute to increasing resilience in terms of redundancy (overlaping fuctions, actions or services).;If not, do you plan to carry out actions upon this subcategory in the future?;To what extent do the actions developed by the initiative and its members contribute to creating or promoting functions, actions and/or services that overlap with others to be alternative means in the face of a sudden and uncertain change, disturbance or;Describe how these actions contribute to increasing resilience in terms of redundancy (overlaping fuctions, actions or services)._26;If not, do you plan to carry out actions upon this subcategory in the future?_27;To what extent do the actions developed by the initiative and its members contribute to promoting and/or creating financial mechanisms to support different types of stakeholders in addressing climate change?;Describe how these actions contribute to increasing financial resilience (insurance, credit, taxes, etc.).;If not, do you plan to carry out actions upon this subcategory in the future?_28;To what extent do the actions developed by the initiative and its members contribute to (a) promote the conservation/restoration of ecosystems and (b) promote activities that seek to improve the ecological services accessed by people?;Describe how these actions contribute to increasing the resilience of ecosystems and ecological services.;If not, do you plan to carry out actions upon this subcategory in the future?_29;To what extent do the actions developed by the initiative and its members promote and/or create technological mechanisms to address climate change?;Describe how these actions contribute to increasing resilience through the delivery of technological resources.;If not, do you plan to carry out actions upon this subcategory in the future?_30;To what extent do the actions developed by the initiative and its members contribute to the construction, improvement and/or maintenance of sustainable infrastructure in the face of climate risks and/or adaptation?;Describe how these actions contribute to building resilience in infrastructure to cope with climate change.;If not, do you plan to carry out actions upon this subcategory in the future?_31;To what extent do the actions developed by the initiative and its members provide access to emergency and other services?;Describe how these actions contribute to increasing the resilience of emergency and social services.;If not, do you plan to carry out actions upon this subcategory in the future?_32;Final comments (optional)
ID MASTER;PARTNER OFFICAL NAME;PARTNER SHORTNAME;;;;;;;;;;Open-Ended Response;Response;Open-Ended Response;Open-Ended Response;Response;Women and girls;LGTBQIA+ people;Elderly;Children & Youth;Indigenous and traditional communities;Racial, ethnic or religious minorities;Refugees;Disabled People;Low income communities;Other (please specify);VMC are partners/co-leads in the project/action;VMC are consulted (unidirectional) prior to the project/action;VMC are consulted (unidirectional) during the project/action;VMC co-construct the content of the project/action;VMC are not consulted;VMC are not targeted;Other (please specify);Response;Other (please specify);Open-Ended Response;Open-Ended Response;Response;Open-Ended Response;Open-Ended Response;Response;Open-Ended Response;Open-Ended Response;Response;Open-Ended Response;Open-Ended Response;Response;Open-Ended Response;Open-Ended Response;Response;Open-Ended Response;Open-Ended Response;Response;Open-Ended Response;Open-Ended Response;Response;Open-Ended Response;Open-Ended Response;Response;Open-Ended Response;Open-Ended Response;Response;Open-Ended Response;Open-Ended Response;Response;Open-Ended Response;Open-Ended Response;Response;Open-Ended Response;Open-Ended Response;Response;Open-Ended Response;Open-Ended Response;Response;Open-Ended Response;Open-Ended Response;Response;Open-Ended Response;Open-Ended Response;Response;Open-Ended Response;Open-Ended Response;Response;Open-Ended Response;Open-Ended Response;Response;Open-Ended Response;Open-Ended Response;Open-Ended Response
18;Climate Resilient Housing;CRH;1,18E+11;446275184;06/28/2022 04:29:22 PM;10-04-2022 14:39;4714168124;;;;;Climate Resilient Housing;3- This subcategory is in the core of an important part of our actions;;;3- This subcategory is in the core of an important part of our actions;Women and girls;;;;;;;;Low income communities;;VMC are partners/co-leads in the project/action;;;;;;;Involvement and impact are intentional;;;;3- This subcategory is in the core of an important part of our actions;Home improvements make up preparedness, prevention and recovery, depending on the area of intervention. We also work with homeowners so that they are aware of the overall disaster risks and can take immediate action (closing shutters, moving items to second story, acquiring basic supplies) to prepare for a disaster.;;2- A few of our actions contribute to this subcategory;In government-focused interventions, we work with governments to develop and refine plans for disaster risk management as it relates to buildings and housing.;;1- We contribute to this subcategory but indirectly, It’s not in the core of our activities;;;3- This subcategory is in the core of an important part of our actions.;Some partners have interventions to increase the capacity of the construction and engineering workforce, such as to improve the quality of bricks or use resilient building practices.;;3- This subcategory is in the core of an important part of our actions.;Many of CRH's partners' homeowner-driven interventions create financial pathways so they can access grant and subsidy programs to make improvements to their own housing.;;1- We contribute to this subcategory but indirectly, It’s not in the core of our activities;;;1- We contribute to this subcategory but indirectly, It’s not in the core of our activities;;;0- We do not develop actions that contribute to this subcategory;We do not develop actions that contribute to this subcategory.;;0- We do not develop actions that contribute to this subcategory;Creating networks of construction professionals.;;2- A few of our actions contribute to this subcategory;Creating networks of construction professionals.;;2- A few of our actions contribute to this subcategory;;;2- A few of our actions contribute to this subcategory;;;3- This subcategory is in the core of an important part of our actions;Access to home improvement finance, technical assistance to grant and subsidy programs.;;0- We do not develop actions that contribute to this subcategory;We do not develop actions that contribute to this subcategory.;;4- This subcategory is in the core of the most of our actions;"Engineering technology through best practices in climate resilient buildings; digital technology through BIM, AI, MIS systems to improve efficiency and accuracy of interventions.";;4- This subcategory is in the core of the most of our actions;;;1- We contribute to this subcategory but indirectly, It’s not in the core of our activities;;;
20;Scale for Resilience Nature-based solutions;S4R;1,18E+11;446275184;10-07-2022 10:49;10/17/2022 05:27:30 PM;8013311356;;;;;Scale for Resilience;4- This subcategory is in the core of the most of our actions;We are addressing the full financial value chain in the global South with Microfinance institutions being our key members. Providing access to finance for smallholder farmers and vulnerable communities is their core business mission.;;4- This subcategory is in the core of the most of our actions;Women and girls;;;;Indigenous and traditional communities;;;;Low income communities;we focus on smallholder farmers and most vulnerable communities;;;VMC are consulted (unidirectional) during the project/action;;;;;Involvement and impact are intentional;;We provide access to finance. Access to finance translates into societal participation and empowerment.;;4- This subcategory is in the core of the most of our actions;Active resilience finance facilitated by our members, MFIs in the global South, is fostering climate change resilience among the most vulnerable. It supports them to prepare for adverse climate impacts.;;4- This subcategory is in the core of the most of our actions;Providing green financial products financing nature-based Solutions provides the basis to build up climate resilience on a strategic dimension. NbS can be combined to increase resilience over time, while increased productivity supports the creditworthiness. By promoting NbS our members foster knowledge transfer that is a key component for the strategic planning.;;4- This subcategory is in the core of the most of our actions;By promoting NbS our members foster knowledge transfer towards the most vulnerable on adaptation opportunities. Often through own formats and community events or demonstration farms. Scale for resilience fosters the knowledge transfer on the macro-level through webinars and other formats.;;4- This subcategory is in the core of the most of our actions;Scale for resilience fosters the knowledge transfer through webinars and other formats for its members and the interested public. These include coping strategies, digital technologies and best practices on green product implementation...among others.;;4- This subcategory is in the core of the most of our actions;Our members, Impact Investors and MFIs, focus on providing access to finance for adaptation, this provides the basis for autonomy.;;1- We contribute to this subcategory but indirectly, It’s not in the core of our activities;;;1- We contribute to this subcategory but indirectly, It’s not in the core of our activities;;;2- A few of our actions contribute to this subcategory;Access to finance. e.g. to a smallholder farmer does not only empower him/her, it helps communities to thrive. Other members of the community find work with him/her, he/she can pass on their agricultural knowledge.;;0- We do not develop actions that contribute to this subcategory;Maybe, but rather indirectly - via access to finance.;maybe, but rather indirectly - via access to finance;4- This subcategory is in the core of the most of our actions;Many of our members, the so-called MFIs, are cooperatives with a focus on agriculture supporting their members. Community events on farming practices and/or climate solutions and their advantages are a common activity for them.;;4- This subcategory is in the core of the most of our actions;"It obviously depends on the institutional maturity with regard to resilience finance how divers the outcome is. However, we developed our own methodology ""Path to resilience"" which allows our member institutions to embark on a step-wise approach to the topic of resilience finance. Once they measure climate vulnerabilities and have dedicated green loan products any focus is thinkable. We have developed a biodiversity indicator (with UNEP) and are finalizing a taxonomy of resilience enhancing investment targets (currently about 200), across agriculture but also SME finance. Our project can include very different actors, from financial institutions to input providers, farming associations, and also different end-beneficiaries.";;4- This subcategory is in the core of the most of our actions;As explained in the previous question: We have many investment targets, these include water reservoirs, rain drainages, bio-digestors, greehouse, storage systems...the list is long.;;4- This subcategory is in the core of the most of our actions;We facilitate access to finance to increase resilience for the most vulnerable,, like smallholder farmers. It can be individual loans or group loans, but all our members are active in inclusive finance, so mostly microloans. This is our core activity.;;4- This subcategory is in the core of the most of our actions;We connect microfinance with respective adaptation measures, like nature-based Solutions. NbS don't harm ecosystems (the bare minimum), but many increase the quality of ecosystems as well biodiversity.;;4- This subcategory is in the core of the most of our actions;As mentioned before, our taxonomy for investment targets is quite comprehensive: It covers also credit covering e.g. efficient cooking stoves, water filters or solar pumps.;;0- We do not develop actions that contribute to this subcategory;We do not embark in infrastructure projects. Our members are active in microfinance and som SME finance. The amounts therein do not correspond to projects regarding critical infrastructure.;We do not embark in infrastructure projects. Our members are active in microfinance and som SME finance. The amounts therein do not correspond to projects regarding critical infrastructure;0- We do not develop actions that contribute to this subcategory;We do not develop actions that contribute to this subcategory.;;
5;Efficiency for Access Coalition;EforA;1,18E+11;446275184;07/13/2022 07:10:06 AM;10-04-2022 14:35;570126135;;;;;Efficiency for Access Coalition;3- This subcategory is in the core of an important part of our actions;All our activities are disaggregated by Male and Female. Our impact is calculated to show how many women and girls are gaining access to energy and lives are improved. We are developed an inclusion report.;;3- This subcategory is in the core of an important part of our actions;Women and girls;;Elderly;;;;Refugees;Disabled People;Low income communities;;;;;;VMC are not consulted;;;Involvement and impact are incidental;;We do not have control over who applies for finance to purchase affordable appliances. We focus on middle and low income countries inline with the HDI index countries however we don't know who the specific individuals are.;;0- We do not develop actions that contribute to this subcategory;We make sure all the R&D grants developed are able to measure targets for E missions reduced and we measure reduced emissions at impact.;We make sure all the R&D grants developed are able to measure targets for E missions reduced and we measure reduced emissions at impact.;3- This subcategory is in the core of an important part of our actions;"Part of our theory of change is planning how change will happen and measuring change. we have a whole workstream dedicated to strategic planning for the project and with partners in the energy for access coalition focus on the broader EforA ecosystem well coordinated to ensure impact and VfM are maximized; stakeholders aligned and mobilized around a shared vision and goals for solar appliances;outputs inform and drive markets.";;3- This subcategory is in the core of an important part of our actions.;Early careers prepared with skills, knowledge​ sector  and innovation supported through Design Challenge competitions that provide training and curriculum tailored to solar powered appliances, industry mentoring and link to internships  Growth and strengthening of early careers to develop a career and help deliver the clean energy transition and support local assembly, installation and repair of appliances and PURE technologies.;;3- This subcategory is in the core of an important part of our actions.;Learning is a cross-cutting theme as we work to build capacity in all workstreams and campaigns to increase knowledge in the energy sector.;;1- We contribute to this subcategory but indirectly, It’s not in the core of our activities;Through working on affordability and cost reduction of appliances this leads people to make the decision to purchase appliances that will lead to improved wellbeing and income and that leads to agency.;;0- We do not develop actions that contribute to this subcategory;We do not develop actions that contribute to this subcategory.;;0- We do not develop actions that contribute to this subcategory;We do not develop actions that contribute to this subcategory.;;0- We do not develop actions that contribute to this subcategory;We do not develop actions that contribute to this subcategory.;;0- We do not develop actions that contribute to this subcategory;We do not develop actions that contribute to this subcategory.;;;"Through market intelligence, research and learning  disseminated  EforA brand recognized as leading voice of solar appliance sector  EforA efforts multiplied by additional partners; EforA communications inform decision making by actors in and beyond the solar appliances sector.";;0- We do not develop actions that contribute to this subcategory;We plan to put in place a gender and inclusion strategy that will also include diversity. We work with people and support people from all backgrounds so our projects are diverse.;We plan to put in place a gender and inclusion strategy that will also include diversity. We work with people and support people from all backgrounds so our projects are diverse;0- We do not develop actions that contribute to this subcategory;We measure number of people with jobs and support job creation through our R&D grants focusing on gender and creating jobs for women.;;1- We contribute to this subcategory but indirectly, It’s not in the core of our activities;Increased financial flows to accelerate affordable appliance and PURE technologies market growth leads to reduced emissions .;;0- We do not develop actions that contribute to this subcategory;We support sales of SWP that work natural resources such as utilizing the earth for agriculture. All our appliances are based on solar .;We support sales of SWP that work natural resources such as utilizing the earth for agriculture. All our appliances are based on solar .;4- This subcategory is in the core of the most of our actions;Improved affordability and performance of a range of affordable appliance and PURE technologies that are suited for off- and weak-grid contexts . technologies we support are PUE, TV, Fans, Refrigeration, SWP and Cold Rooms and we are planning to support more technologies in the next few years.;;0- We do not develop actions that contribute to this subcategory;;;0- We do not develop actions that contribute to this subcategory;We are planning in the next three years on working to support the humanitarian sector through appliances that are sustainable.;;
